{
  "$schema": "https://json-schema.org/draft/2020-12/schema",
  "$id": "DeveloperLensDecisionExport.v1",
  "type": "object",
  "additionalProperties": false,
  "required": [
    "schemaVersion",
    "project",
    "generatedAt",
    "decisions"
  ],
  "properties": {
    "schemaVersion": {
      "const": "DeveloperLensDecisionExport.v1"
    },
    "project": {
      "const": "Chris0Jeky/developer-lens"
    },
    "generatedAt": {
      "type": "string",
      "format": "date-time"
    },
    "sourceSnapshot": {
      "type": "string",
      "format": "date"
    },
    "decisions": {
      "type": "array",
      "items": {
        "type": "object",
        "additionalProperties": false,
        "required": [
          "decisionId",
          "selectedOptionId",
          "status",
          "rationale",
          "confirmedByOwner"
        ],
        "properties": {
          "decisionId": {
            "type": "string",
            "pattern": "^[A-Z]+-[0-9]{2}$"
          },
          "area": {
            "type": "string"
          },
          "title": {
            "type": "string"
          },
          "selectedOptionId": {
            "type": [
              "string",
              "null"
            ]
          },
          "selectedOptionLabel": {
            "type": [
              "string",
              "null"
            ]
          },
          "status": {
            "enum": [
              "confirmed",
              "proposed-default",
              "changed-unconfirmed",
              "deferred"
            ]
          },
          "rationale": {
            "type": "string"
          },
          "confirmedByOwner": {
            "type": "boolean"
          },
          "notes": {
            "type": "string"
          }
        },
        "allOf": [
          {
            "if": {
              "required": [
                "status"
              ],
              "properties": {
                "status": {
                  "const": "confirmed"
                }
              }
            },
            "then": {
              "properties": {
                "selectedOptionId": {
                  "type": "string",
                  "minLength": 1,
                  "pattern": "\\S"
                },
                "confirmedByOwner": {
                  "const": true
                }
              }
            }
          }
        ]
      }
    }
  }
}
